{
  "format": "exportaramus-snapshot",
  "schemaVersion": "1.0",
  "exportaramusVersion": "0.1.0.0",
  "exportedAtUtc": "2026-09-06T12:00:00.0000000Z",
  "capturedAtUtc": "2026-09-06T12:00:00.0000000Z",
  "captureType": "Full",
  "captureGeneration": 1,
  "consistency": "Coherent",
  "catalog": {
    "clientLanguage": "English",
    "gameDataVersion": "2026.08.11.0000.0000"
  },
  "character": {
    "displayName": "Ala'm'n <Pipoke> \u00c9toile"
  },
  "collections": {
    "mounts": {
      "label": "mounts",
      "ownershipKind": "PermanentUnlock",
      "totalKnown": true,
      "sourceStatus": "Fresh",
      "completeness": "Complete",
      "provenanceType": "Observed",
      "observedAtUtc": "2026-09-06T12:00:00.0000000Z",
      "items": [
        {
          "id": 1,
          "name": "Fixture mounts",
          "owned": true,
          "ownershipEvidence": {
            "ruleCode": "DirectPermanentUnlock",
            "facts": [
              {
                "dataType": "PermanentUnlock",
                "sourceKey": "mounts",
                "subjectId": 1,
                "state": "Present",
                "sourceStatus": "Fresh"
              }
            ]
          }
        }
      ]
    },
    "minions": {
      "label": "minions",
      "ownershipKind": "PermanentUnlock",
      "totalKnown": true,
      "sourceStatus": "Fresh",
      "completeness": "Complete",
      "provenanceType": "Observed",
      "observedAtUtc": "2026-09-06T12:00:00.0000000Z",
      "items": [
        {
          "id": 1,
          "name": "Fixture minions",
          "owned": true,
          "ownershipEvidence": {
            "ruleCode": "DirectPermanentUnlock",
            "facts": [
              {
                "dataType": "PermanentUnlock",
                "sourceKey": "minions",
                "subjectId": 1,
                "state": "Present",
                "sourceStatus": "Fresh"
              }
            ]
          }
        }
      ]
    },
    "emotes": {
      "label": "emotes",
      "ownershipKind": "PermanentUnlock",
      "totalKnown": true,
      "sourceStatus": "Fresh",
      "completeness": "Complete",
      "provenanceType": "Observed",
      "observedAtUtc": "2026-09-06T12:00:00.0000000Z",
      "items": [
        {
          "id": 1,
          "name": "Fixture emotes",
          "owned": true,
          "ownershipEvidence": {
            "ruleCode": "DirectPermanentUnlock",
            "facts": [
              {
                "dataType": "PermanentUnlock",
                "sourceKey": "emotes",
                "subjectId": 1,
                "state": "Present",
                "sourceStatus": "Fresh"
              }
            ]
          }
        }
      ]
    },
    "bardings": {
      "label": "bardings",
      "ownershipKind": "PermanentUnlock",
      "totalKnown": true,
      "sourceStatus": "Fresh",
      "completeness": "Complete",
      "provenanceType": "Observed",
      "observedAtUtc": "2026-09-06T12:00:00.0000000Z",
      "items": [
        {
          "id": 1,
          "name": "Fixture bardings",
          "owned": true,
          "ownershipEvidence": {
            "ruleCode": "DirectPermanentUnlock",
            "facts": [
              {
                "dataType": "PermanentUnlock",
                "sourceKey": "bardings",
                "subjectId": 1,
                "state": "Present",
                "sourceStatus": "Fresh"
              }
            ]
          }
        }
      ]
    },
    "cards": {
      "label": "cards",
      "ownershipKind": "PermanentUnlock",
      "totalKnown": true,
      "sourceStatus": "Fresh",
      "completeness": "Complete",
      "provenanceType": "Observed",
      "observedAtUtc": "2026-09-06T12:00:00.0000000Z",
      "items": [
        {
          "id": 1,
          "name": "Fixture cards",
          "owned": true,
          "ownershipEvidence": {
            "ruleCode": "DirectPermanentUnlock",
            "facts": [
              {
                "dataType": "PermanentUnlock",
                "sourceKey": "cards",
                "subjectId": 1,
                "state": "Present",
                "sourceStatus": "Fresh"
              }
            ]
          }
        }
      ]
    },
    "npcs": {
      "label": "npcs",
      "ownershipKind": "PermanentUnlock",
      "totalKnown": true,
      "sourceStatus": "Fresh",
      "completeness": "Complete",
      "provenanceType": "Observed",
      "observedAtUtc": "2026-09-06T12:00:00.0000000Z",
      "items": [
        {
          "id": 1,
          "name": "Fixture npcs",
          "owned": true,
          "ownershipEvidence": {
            "ruleCode": "DirectPermanentUnlock",
            "facts": [
              {
                "dataType": "PermanentUnlock",
                "sourceKey": "npcs",
                "subjectId": 1,
                "state": "Present",
                "sourceStatus": "Fresh"
              }
            ]
          }
        }
      ]
    },
    "fashions": {
      "label": "fashions",
      "ownershipKind": "PermanentUnlock",
      "totalKnown": true,
      "sourceStatus": "Fresh",
      "completeness": "Complete",
      "provenanceType": "Observed",
      "observedAtUtc": "2026-09-06T12:00:00.0000000Z",
      "items": [
        {
          "id": 1,
          "name": "Fixture fashions",
          "owned": true,
          "ownershipEvidence": {
            "ruleCode": "DirectPermanentUnlock",
            "facts": [
              {
                "dataType": "PermanentUnlock",
                "sourceKey": "fashions",
                "subjectId": 1,
                "state": "Present",
                "sourceStatus": "Fresh"
              }
            ]
          }
        }
      ]
    },
    "frames": {
      "label": "frames",
      "ownershipKind": "PermanentUnlock",
      "totalKnown": true,
      "sourceStatus": "Fresh",
      "completeness": "Complete",
      "provenanceType": "Observed",
      "observedAtUtc": "2026-09-06T12:00:00.0000000Z",
      "items": [
        {
          "id": 1,
          "name": "Fixture frames",
          "owned": true,
          "ownershipEvidence": {
            "ruleCode": "DirectPermanentUnlock",
            "facts": [
              {
                "dataType": "PermanentUnlock",
                "sourceKey": "frames",
                "subjectId": 1,
                "state": "Present",
                "sourceStatus": "Fresh"
              }
            ]
          }
        }
      ]
    },
    "occult_records": {
      "label": "occult_records",
      "ownershipKind": "PermanentUnlock",
      "totalKnown": true,
      "sourceStatus": "Fresh",
      "completeness": "Complete",
      "provenanceType": "Observed",
      "observedAtUtc": "2026-09-06T12:00:00.0000000Z",
      "items": [
        {
          "id": 1,
          "name": "Fixture occult_records",
          "owned": true,
          "ownershipEvidence": {
            "ruleCode": "DirectPermanentUnlock",
            "facts": [
              {
                "dataType": "PermanentUnlock",
                "sourceKey": "occult_records",
                "subjectId": 1,
                "state": "Present",
                "sourceStatus": "Fresh"
              }
            ]
          }
        }
      ]
    },
    "orchestrions": {
      "label": "orchestrions",
      "ownershipKind": "PermanentUnlock",
      "totalKnown": true,
      "sourceStatus": "Fresh",
      "completeness": "Complete",
      "provenanceType": "Observed",
      "observedAtUtc": "2026-09-06T12:00:00.0000000Z",
      "items": [
        {
          "id": 1,
          "name": "Fixture orchestrions",
          "owned": true,
          "ownershipEvidence": {
            "ruleCode": "DirectPermanentUnlock",
            "facts": [
              {
                "dataType": "PermanentUnlock",
                "sourceKey": "orchestrions",
                "subjectId": 1,
                "state": "Present",
                "sourceStatus": "Fresh"
              }
            ]
          }
        }
      ]
    },
    "spells": {
      "label": "spells",
      "ownershipKind": "PermanentUnlock",
      "totalKnown": true,
      "sourceStatus": "Fresh",
      "completeness": "Complete",
      "provenanceType": "Observed",
      "observedAtUtc": "2026-09-06T12:00:00.0000000Z",
      "items": [
        {
          "id": 1,
          "name": "Fixture spells",
          "owned": true,
          "ownershipEvidence": {
            "ruleCode": "DirectPermanentUnlock",
            "facts": [
              {
                "dataType": "PermanentUnlock",
                "sourceKey": "spells",
                "subjectId": 1,
                "state": "Present",
                "sourceStatus": "Fresh"
              }
            ]
          }
        }
      ]
    },
    "aetherytes": {
      "label": "aetherytes",
      "ownershipKind": "PermanentUnlock",
      "totalKnown": true,
      "sourceStatus": "Fresh",
      "completeness": "Complete",
      "provenanceType": "Observed",
      "observedAtUtc": "2026-09-06T12:00:00.0000000Z",
      "items": [
        {
          "id": 1,
          "name": "Fixture aetherytes",
          "owned": true,
          "ownershipEvidence": {
            "ruleCode": "DirectPermanentUnlock",
            "facts": [
              {
                "dataType": "PermanentUnlock",
                "sourceKey": "aetherytes",
                "subjectId": 1,
                "state": "Present",
                "sourceStatus": "Fresh"
              }
            ]
          }
        }
      ]
    },
    "chocobo_routes": {